{"component_count":45,"dependencies":[{"dependsOn":[],"ref":"pkg:cargo/bitflags@2.13.0"},{"dependsOn":["pkg:cargo/hybrid-array@0.4.13"],"ref":"pkg:cargo/block-buffer@0.12.1"},{"dependsOn":[],"ref":"pkg:cargo/cfg-if@1.0.4"},{"dependsOn":["pkg:cargo/serde@1.0.228","pkg:cargo/serde_json@1.0.150","pkg:cargo/sha2@0.11.0","pkg:cargo/unicode-normalization@0.1.25"],"ref":"pkg:cargo/cigar-canon@0.1.0"},{"dependsOn":["pkg:cargo/cigar-canon@0.1.0","pkg:cargo/getrandom@0.4.3","pkg:cargo/rustix@1.1.4","pkg:cargo/serde@1.0.228","pkg:cargo/serde_json@1.0.150","pkg:cargo/tokio@1.52.3","pkg:cargo/toml@1.1.2+spec-1.1.0"],"ref":"pkg:cargo/cigar-cli@0.1.0"},{"dependsOn":[],"ref":"pkg:cargo/const-oid@0.10.2"},{"dependsOn":[],"ref":"pkg:cargo/cpufeatures@0.3.0"},{"dependsOn":["pkg:cargo/hybrid-array@0.4.13"],"ref":"pkg:cargo/crypto-common@0.2.2"},{"dependsOn":["pkg:cargo/block-buffer@0.12.1","pkg:cargo/const-oid@0.10.2","pkg:cargo/crypto-common@0.2.2"],"ref":"pkg:cargo/digest@0.11.3"},{"dependsOn":[],"ref":"pkg:cargo/equivalent@1.0.2"},{"dependsOn":["pkg:cargo/libc@0.2.186"],"ref":"pkg:cargo/errno@0.3.14"},{"dependsOn":["pkg:cargo/cfg-if@1.0.4","pkg:cargo/libc@0.2.186"],"ref":"pkg:cargo/getrandom@0.4.3"},{"dependsOn":[],"ref":"pkg:cargo/hashbrown@0.17.1"},{"dependsOn":["pkg:cargo/typenum@1.20.1"],"ref":"pkg:cargo/hybrid-array@0.4.13"},{"dependsOn":["pkg:cargo/equivalent@1.0.2","pkg:cargo/hashbrown@0.17.1"],"ref":"pkg:cargo/indexmap@2.14.0"},{"dependsOn":[],"ref":"pkg:cargo/itoa@1.0.18"},{"dependsOn":[],"ref":"pkg:cargo/libc@0.2.186"},{"dependsOn":[],"ref":"pkg:cargo/linux-raw-sys@0.12.1"},{"dependsOn":[],"ref":"pkg:cargo/memchr@2.8.3"},{"dependsOn":["pkg:cargo/libc@0.2.186"],"ref":"pkg:cargo/mio@1.2.1"},{"dependsOn":[],"ref":"pkg:cargo/pin-project-lite@0.2.17"},{"dependsOn":["pkg:cargo/unicode-ident@1.0.24"],"ref":"pkg:cargo/proc-macro2@1.0.106"},{"dependsOn":["pkg:cargo/proc-macro2@1.0.106"],"ref":"pkg:cargo/quote@1.0.46"},{"dependsOn":["pkg:cargo/bitflags@2.13.0","pkg:cargo/errno@0.3.14","pkg:cargo/libc@0.2.186","pkg:cargo/linux-raw-sys@0.12.1"],"ref":"pkg:cargo/rustix@1.1.4"},{"dependsOn":["pkg:cargo/serde_core@1.0.228","pkg:cargo/serde_derive@1.0.228"],"ref":"pkg:cargo/serde@1.0.228"},{"dependsOn":[],"ref":"pkg:cargo/serde_core@1.0.228"},{"dependsOn":["pkg:cargo/proc-macro2@1.0.106","pkg:cargo/quote@1.0.46","pkg:cargo/syn@2.0.118"],"ref":"pkg:cargo/serde_derive@1.0.228"},{"dependsOn":["pkg:cargo/itoa@1.0.18","pkg:cargo/memchr@2.8.3","pkg:cargo/serde_core@1.0.228","pkg:cargo/zmij@1.0.22"],"ref":"pkg:cargo/serde_json@1.0.150"},{"dependsOn":["pkg:cargo/serde_core@1.0.228"],"ref":"pkg:cargo/serde_spanned@1.1.1"},{"dependsOn":["pkg:cargo/cfg-if@1.0.4","pkg:cargo/cpufeatures@0.3.0","pkg:cargo/digest@0.11.3"],"ref":"pkg:cargo/sha2@0.11.0"},{"dependsOn":["pkg:cargo/errno@0.3.14","pkg:cargo/libc@0.2.186"],"ref":"pkg:cargo/signal-hook-registry@1.4.8"},{"dependsOn":["pkg:cargo/proc-macro2@1.0.106","pkg:cargo/quote@1.0.46","pkg:cargo/unicode-ident@1.0.24"],"ref":"pkg:cargo/syn@2.0.118"},{"dependsOn":["pkg:cargo/tinyvec_macros@0.1.1"],"ref":"pkg:cargo/tinyvec@1.12.0"},{"dependsOn":[],"ref":"pkg:cargo/tinyvec_macros@0.1.1"},{"dependsOn":["pkg:cargo/proc-macro2@1.0.106","pkg:cargo/quote@1.0.46","pkg:cargo/syn@2.0.118"],"ref":"pkg:cargo/tokio-macros@2.7.0"},{"dependsOn":["pkg:cargo/libc@0.2.186","pkg:cargo/mio@1.2.1","pkg:cargo/pin-project-lite@0.2.17","pkg:cargo/signal-hook-registry@1.4.8","pkg:cargo/tokio-macros@2.7.0"],"ref":"pkg:cargo/tokio@1.52.3"},{"dependsOn":["pkg:cargo/indexmap@2.14.0","pkg:cargo/serde_core@1.0.228","pkg:cargo/serde_spanned@1.1.1","pkg:cargo/toml_datetime@1.1.1+spec-1.1.0","pkg:cargo/toml_parser@1.1.2+spec-1.1.0","pkg:cargo/toml_writer@1.1.1+spec-1.1.0","pkg:cargo/winnow@1.0.3"],"ref":"pkg:cargo/toml@1.1.2+spec-1.1.0"},{"dependsOn":["pkg:cargo/serde_core@1.0.228"],"ref":"pkg:cargo/toml_datetime@1.1.1+spec-1.1.0"},{"dependsOn":["pkg:cargo/winnow@1.0.3"],"ref":"pkg:cargo/toml_parser@1.1.2+spec-1.1.0"},{"dependsOn":[],"ref":"pkg:cargo/toml_writer@1.1.1+spec-1.1.0"},{"dependsOn":[],"ref":"pkg:cargo/typenum@1.20.1"},{"dependsOn":[],"ref":"pkg:cargo/unicode-ident@1.0.24"},{"dependsOn":["pkg:cargo/tinyvec@1.12.0"],"ref":"pkg:cargo/unicode-normalization@0.1.25"},{"dependsOn":[],"ref":"pkg:cargo/winnow@1.0.3"},{"dependsOn":[],"ref":"pkg:cargo/zmij@1.0.22"}],"dependency_edge_count":66,"external_packages":[{"checksum":"b4388bee8683e3d04af747c73422af53102d2bd24d9eadb6cbc100baef4b43f8","name":"bitflags","source":"registry+https://github.com/rust-lang/crates.io-index","version":"2.13.0"},{"checksum":"d2f6c7dbe95a6ed67ad9f18e57daf93a2f034c524b99fd2b76d18fdfeb6660aa","name":"block-buffer","source":"registry+https://github.com/rust-lang/crates.io-index","version":"0.12.1"},{"checksum":"9330f8b2ff13f34540b44e946ef35111825727b38d33286ef986142615121801","name":"cfg-if","source":"registry+https://github.com/rust-lang/crates.io-index","version":"1.0.4"},{"checksum":"a6ef517f0926dd24a1582492c791b6a4818a4d94e789a334894aa15b0d12f55c","name":"const-oid","source":"registry+https://github.com/rust-lang/crates.io-index","version":"0.10.2"},{"checksum":"8b2a41393f66f16b0823bb79094d54ac5fbd34ab292ddafb9a0456ac9f87d201","name":"cpufeatures","source":"registry+https://github.com/rust-lang/crates.io-index","version":"0.3.0"},{"checksum":"ce6e4c961d6cd6c9a86db418387425e8bdeaf05b3c8bc1411e6dca4c252f1453","name":"crypto-common","source":"registry+https://github.com/rust-lang/crates.io-index","version":"0.2.2"},{"checksum":"f1dd6dbb5841937940781866fa1281a1ff7bd3bf827091440879f9994983d5c2","name":"digest","source":"registry+https://github.com/rust-lang/crates.io-index","version":"0.11.3"},{"checksum":"877a4ace8713b0bcf2a4e7eec82529c029f1d0619886d18145fea96c3ffe5c0f","name":"equivalent","source":"registry+https://github.com/rust-lang/crates.io-index","version":"1.0.2"},{"checksum":"39cab71617ae0d63f51a36d69f866391735b51691dbda63cf6f96d042b63efeb","name":"errno","source":"registry+https://github.com/rust-lang/crates.io-index","version":"0.3.14"},{"checksum":"300e883d756b2e4ec94e02791f39b04b522276138852cfc41d9fb7e904106099","name":"getrandom","source":"registry+https://github.com/rust-lang/crates.io-index","version":"0.4.3"},{"checksum":"ed5909b6e89a2db4456e54cd5f673791d7eca6732202bbf2a9cc504fe2f9b84a","name":"hashbrown","source":"registry+https://github.com/rust-lang/crates.io-index","version":"0.17.1"},{"checksum":"818356c5132c1fede50f837ca96afbe78ff42413047f4abb886217845e1b6c8c","name":"hybrid-array","source":"registry+https://github.com/rust-lang/crates.io-index","version":"0.4.13"},{"checksum":"d466e9454f08e4a911e14806c24e16fba1b4c121d1ea474396f396069cf949d9","name":"indexmap","source":"registry+https://github.com/rust-lang/crates.io-index","version":"2.14.0"},{"checksum":"8f42a60cbdf9a97f5d2305f08a87dc4e09308d1276d28c869c684d7777685682","name":"itoa","source":"registry+https://github.com/rust-lang/crates.io-index","version":"1.0.18"},{"checksum":"68ab91017fe16c622486840e4c83c9a37afeff978bd239b5293d61ece587de66","name":"libc","source":"registry+https://github.com/rust-lang/crates.io-index","version":"0.2.186"},{"checksum":"32a66949e030da00e8c7d4434b251670a91556f4144941d37452769c25d58a53","name":"linux-raw-sys","source":"registry+https://github.com/rust-lang/crates.io-index","version":"0.12.1"},{"checksum":"cf8baf1c55e62ffcace7a9f06f4bd9cd3f0c4beb022d3b367256b91b87513d98","name":"memchr","source":"registry+https://github.com/rust-lang/crates.io-index","version":"2.8.3"},{"checksum":"02bd0af71c67b473010cbbc60715ee815645a4dc942899111f494b4b737d6fda","name":"mio","source":"registry+https://github.com/rust-lang/crates.io-index","version":"1.2.1"},{"checksum":"a89322df9ebe1c1578d689c92318e070967d1042b512afbe49518723f4e6d5cd","name":"pin-project-lite","source":"registry+https://github.com/rust-lang/crates.io-index","version":"0.2.17"},{"checksum":"8fd00f0bb2e90d81d1044c2b32617f68fcb9fa3bb7640c23e9c748e53fb30934","name":"proc-macro2","source":"registry+https://github.com/rust-lang/crates.io-index","version":"1.0.106"},{"checksum":"dfbc457d0c7a0759a614551b11a6409e5951f6c7537be1f1b7682b9ae9230368","name":"quote","source":"registry+https://github.com/rust-lang/crates.io-index","version":"1.0.46"},{"checksum":"b6fe4565b9518b83ef4f91bb47ce29620ca828bd32cb7e408f0062e9930ba190","name":"rustix","source":"registry+https://github.com/rust-lang/crates.io-index","version":"1.1.4"},{"checksum":"9a8e94ea7f378bd32cbbd37198a4a91436180c5bb472411e48b5ec2e2124ae9e","name":"serde","source":"registry+https://github.com/rust-lang/crates.io-index","version":"1.0.228"},{"checksum":"41d385c7d4ca58e59fc732af25c3983b67ac852c1a25000afe1175de458b67ad","name":"serde_core","source":"registry+https://github.com/rust-lang/crates.io-index","version":"1.0.228"},{"checksum":"d540f220d3187173da220f885ab66608367b6574e925011a9353e4badda91d79","name":"serde_derive","source":"registry+https://github.com/rust-lang/crates.io-index","version":"1.0.228"},{"checksum":"e8014e44b4736ed0538adeecded0fce2a272f22dc9578a7eb6b2d9993c74cfb9","name":"serde_json","source":"registry+https://github.com/rust-lang/crates.io-index","version":"1.0.150"},{"checksum":"6662b5879511e06e8999a8a235d848113e942c9124f211511b16466ee2995f26","name":"serde_spanned","source":"registry+https://github.com/rust-lang/crates.io-index","version":"1.1.1"},{"checksum":"446ba717509524cb3f22f17ecc096f10f4822d76ab5c0b9822c5f9c284e825f4","name":"sha2","source":"registry+https://github.com/rust-lang/crates.io-index","version":"0.11.0"},{"checksum":"c4db69cba1110affc0e9f7bcd48bbf87b3f4fc7c61fc9155afd4c469eb3d6c1b","name":"signal-hook-registry","source":"registry+https://github.com/rust-lang/crates.io-index","version":"1.4.8"},{"checksum":"1b9ae57f904213ebb649ce6895b8a66c66f0203b9319718f69a5612a065b1422","name":"syn","source":"registry+https://github.com/rust-lang/crates.io-index","version":"2.0.118"},{"checksum":"bb4ebadaa0af04fab11ae01eb5f9fdb5f9c5b875506e210e71c07873528baa7f","name":"tinyvec","source":"registry+https://github.com/rust-lang/crates.